EMOTION,TRANSCRIPTION
neu," We have a great view of the moon from here, though, huh?"
hap," Hmm.  I noticed that, it's pretty. Big old white moon."
neu, [BREATHING]
hap, And look what I got here.
hap," Augie, you bought refreshments."
hap, I guess we don't need glasses.
hap, [BREATHING]
neu, Do you want to go home?  Are you cold?
hap, I'm beginning to think this might be the right spot after all.
sad," Augie, I'm sorry."
neu," Shh.  If we're very quiet, the fish might come."
neu, Or not.
hap, Or not.
hap, I don't care then.
hap, No.  Wrong number. [LAUGHTER]
hap, [LAUGHTER] That sent shivers up my spine.
hap, What shall we do if they suddenly walk in on us.[LAUGHTER]
hap, We'll behave exquisitely.
hap, With perfect poise.
hap, I think I shall do a curtsy.
hap," It's strange; things that ought to matter dreadfully, they just don't matter at all when one's happy.  Do they?"
hap, Yes.  Meaning just that.
hap," Well what does it all mean?  That's what I ask myself in my quest for ultimate truth.  Dear God, what does it all mean?"
hap, Don't laugh at me.  I'm being serious.
hap, Who's they?
hap, Who knows?
hap, Yes.  Yes with all of his might.
hap," Let's be superficial, and just pity those poor philosophers, huh?  Let's blow trumpets and squeakers and enjoy the party for as long as we can, you know, like small, idiotic school children."
hap, [LAUGHTER]
hap, Oh Come and kiss me darling before your body rots and worms pop out of your eye sockets.
hap," Oh Elliott, worms don't pop."
hap," Oh See, I don't care what you do, see.  You can paint yourself green and run naked through the Place Vendome and run off with all of the men of the world.  I shan't say a word, just as long as you love me best."
hap," Aw.  Thank you, darling.  The same applies to you too, except that if you so much as look at another woman I'll kill you."
hap," Oh Charles, that was his name.  He did wiggle so beautifully."
hap," That was a rouser, wasn't it?"
hap," The manager came in, he found us rolling about the floor, biting and scratching like panthers. [LAUGHTER]  How utterly, utterly ridiculous."
hap, [LAUGHTER] I'll never forget his face. [LAUGHTER]
hap, [LAUGHTER] We were very much younger then.
hap, [LAUGHTER] And very much sillier.
hap, And very much sillier.
neu, However I believe the real cause of that row was Peter Burden.
hap, Oh.  You knew there was nothing in that.
neu, I knew nothing of the sort.  You took presents from him.
hap," Presents?  It was only a trivial, little brooch."
neu, You went out of your way to torture me over Peter Burden.
neu, I did not.  You worked that whole thing up in your jealous imagination.
neu," Well, what of it?"
ang, What about me?
neu," I'll have a little, I think."
neu," No particular reason.  Anyhow, they are very small ones."
ang, Don't be stupid.
ang," Really, Amanda."
ang, What?
neu," you going out somewhere, dear?"
ang, No.  I am just making myself fascinating for you.
ang, Oh.  It's a woman's duty to allure the man.
neu," Well as a matter of fact, yes, that's perfectly true."
ang, No it isn't.
neu, Yes it is.
ang, You shut up.
ang," Oh really.  It's a pity you didn't have any brandy, it would have made you a little less disagreeable."
ang," Snap, snap, snap.  You know you are like a little adder."
ang, Nonsense.  They have a bag of venom behind their fangs and they snap. They snap.
ang, They sting. I don't care.  Do you understand?  I don't care if they bark and they roll about like hoops.
ang, Did you see much of Peter Burden after our divorce?
ang," Yes I did, quite a lot."
ang," And I suppose you let him kiss you a good deal more than, too. Yes.  I suppose you guys had a riotous time, huh?  All out, no restraint at all.  Well, you never really had much anyhow."
ang, Mind your own business.
ang," You're quite insufferable, I expect it's because you are drunk."
ang, I think I am not in the least bit drunk.
ang, You've always had a weak head.
ang, I think I mentioned once before that I've had three minute liquor glasses the whole evening long.  A child of two cannot get drunk on that.
ang," On the contrary, a child of two can get violently drunk on only one glass of brandy."
ang," That's very interesting Amanda. How about a child of four?  Or a child of six?  Or a child of nine? We can get a good little conversation going on about this, you know, intemperate tots."
ang, Oh shut up.
ang, Shut up.
ang," Not very funny, darling.  Why don't you have some more brandy."
ang," Look, you better turn that off. I don't want to wake up the people upstairs."
neu, Why?
neu, There are no people upstairs; it's a photographer's studio.
ang, Well then you'll wake up the people downstairs.
neu, They are away in Tunis.
neu, This is no time of year for Tunis.
ang, I will do no such thing.
ang, Fine if you insist on being boorish and idiotic.
ang," Will you turn that off, it's driving me mad."
ang," You are far too temperamental, try to control yourself."
ang, Turn it off.
ang," I won't.  Let go, let go of me. Listen, listen?  I'm sick and tired of listening to you, you sadistic bully."
ang," Amanda, listen, listen."
ang, Oh.  That's very amusing indeed.
ang," Oh shut up.  Let go.  I hate you, I hate you.  Do you hear?  You are a conceited and overbearing and utterly impossible."
ang," You are a vile, ill-tempered, loose living, wicked little beast and I never want to see you again as long as I live."
ang, This is the end.  Do you hear me?  Finally and forever.
ang, You're not going like this.
ang, Oh.  Yes I am.
ang, You're not.
ang," Yes I am.   Stop it. Stop it.  Let go of me. Oh.  You're a cruel fiend.  I loathe and I hate you. Marry you again?  Never, never, never. I hope you die in torment, you brute beast cad."
ang," Shut up. Shut up. God, I wouldn't marry you again if you came crawling back to me on a bended knee.  You are a vile, ill-tempered, mean little wench and I never want to see you again as long as I live."
ang, Next.
ang, My window is open.
neu," Yes, Jones."
ang," No, I need your ID to give you a second ID."
ang, It's really simple if you have a problem with it... Maybe you should--
neu," No, I don't have a passport."
ang, What do you expect me to do?
ang, Probably.
ang, Did you even look at the form?  I filled it out all these questions--
ang, Don't raise your voice with me.
ang, Don't talk to me like I'm a child.
ang, Do you know how long I've been working here? How long have you lived in California?
ang," Maybe you never been to the D.M.V. before, maybe you should get back in line.  You know what?  sit in line again and if you get my number ask for different one."
ang, I am not...I'm not getting to back that line.
neu, Uh huh.  I didn't come here get in yelling match either.
neu, They don't pay me enough to deal people like you.
ang, Why?
ang," Why, because I'm sick of talking to you."
ang," 'Cause you're obviously not talking to me, you're just yelling at me, berating me and telling me I can't fill out forms right."
neu," Hey, Joy come in here."
neu, What's happening?
sad, I have to go back.
sad, I just got a letter I have to go back.
sad, First thing tomorrow morning.
sad," The National Guard is I guess really spread thin and then everyone has to go.  We all have to go back, my whole companies going back."
sad," So yeah, we leave tomorrow..."
sad, ...we're all shipping out.
sad, I just got I feel like I'm in shock actually.
sad, I don't even know what to tell you.
sad, I don't know.
sad, What about the birthday party?
sad, I guess you're just going to have to have it without me.
sad," Hey listen, it's going to be okay though, all right?"
sad, You're going to be fine.
sad," I'm going to be fine too, okay?"
sad, I know I have a good... I have a really good group of guys with me.
sad, We're going to be okay.
sad, You're going with the same ones?
sad, Do promise me you're going to take a lot of pictures.
sad, I know.
sad, It's not the same though.
sad, I just wish there was something I could do.
sad, Run away?
sad, Mm hmm.  We'll build a bunker and never come out.
sad," I really don't want to go, I don't want to go..."
sad, Don't say that.
sad, I love you.
hap, The craziest thing just happened to me.
hap, This girl; she just offered me fifty thousand dollars to marry her.
hap, Why?
neu," Well, she's not a citizen so she wants to get a visa."
hap, Is she on the run?
hap," No, no, no, no, no, no she just... she's not a citizen but she wants her visa, yeah. She's going to pay me fifty thousand dollars to marry her and stay married to her for two years."
hap," Oh, she just needs to marry you."
hap, That's incredible. That's awesome. Where's she from?  Maybe you can get a dual citizenship.
hap, That's like twenty five thousand dollar a year for doing nothing. Isn't that awesome?
neu," She's actually from England, I think.  Well she- she spoke English but she had an accent. I didn't even ask."
hap, That's so cool. Uh huh.
hap, [LAUGHTER] Why did she pick you? Where were you?
hap," Fifty thousand dollars. Fifty thousand dollars. I was just out... I just... she's - well, she's a friend of friend but like..."
hap, You were at a party? And she's like hey. You seem unattached she's like.
hap," Yeah.  Can you believe that? Yeah, she's like hey, I'm like sure I'll do it, I don't care. Yeah. I'm like fifty thousand dollars, I'd totally do it for fifty thousand dollars. But the only thing is that's kind of like illegal. So like I could go to jail probably for a long if I get caught, but..."
hap, That's unbelievable... Yeah.
hap, Well I've known people who have done this before. Yeah.  You just- it's really fun actually 'cause you have like a fake engagement party and all your friends come over and like...
hap, It's like I'm really going to get married. We'll have like the whole thing.
hap," Oh, good. [LAUGHTER]"
hap," Yeah. Yeah. And then yeah, and then you know like you could like you could do like like sock her for a lot of money"
hap, I know. What do you think I should-
hap," Like make her rent the apartment that you two have to live together in, you know. And you won't pay any rent or you pay like, a hundred bucks a month or something."
hap, Oh good idea.
neu, Yeah.  Make her like open the bank account and stuff too.
hap, Yeah.
hap, It's a good idea.
hap," Dude, you lucked out."
hap, I know.  Also I get to like plan the wedding now too. That will be fun.
hap," Yeah.  My colors are blush and beige what is it, do you know?"
hap," Something blue, something new, something... no I don't know. [LAUGHTER] So yeah, wonder if she's going to pay me up front but do you think it's bad though, do you think they're going to like track the money or something?"
hap, Oh I don't know. [LAUGHTER]
neu, I don't know get it in cash.
neu, Just cash hardcore.
neu, Yeah.
hap, What should we do?  Where should we get married? We should have party.
hap, How exciting. You should have a wedding on the beach.
hap," Yeah, like a big like- A wedding on the beach, that would be nice."
hap," Yeah, at night."
neu, And then we can honeymoon.  I want to go tropical though like Bahamas- --or like Tahiti or something. I just want to like beach and like drink.
neu," Oh yeah, absolutely, absolutely."
hap, How exciting.  You should make her bring all your friends too.
hap, I'll make her pay for that.  I hear she's like totally wealthy. She's like royalty- --or something like and- --whatever like removed or something but yeah.
hap, [GARBAGE] She's got to be loaded.  fifty thousand dollars.  That's incredible.
hap, Incredible.
hap, I'm going to marry a blue blood. [LAUGHTER]
hap," you're a lucky, lucky, lucky man."
hap, Will you help me plan?
hap," Oh, totally. Yeah."
neu, You seem kind of down.
neu, What do you mean?
neu, There's a lot of people looking for jobs.
neu," I don't know, I mean, I just don't think..."
neu, Did you ever think it might be your attitude that's...
neu," I don't know just sometimes you get kind of... No, I'm not saying that.  I just--"
neu, ...has anyone ever just said anything like that to you before?
neu," Right, sure."
neu," But I mean you kind of got to, you got to fake it 'til you feel it, right?"
neu, I'm just saying that if I was looking to hire somebody in the--or kind of... No. No. No.
neu, No.  I'm just saying though that if I was a person who was hiring somebody I-- --would not hire someone who was angry or upset.
neu, No.
ang, What?
neu," Well, you know a little.  If you were to listen to--"
neu, I just don't want you to fly off the handle.
neu, You kind of have a short fuse.
neu, Yeah.
ang," Okay. Okay no, no, no, no okay no, I need to hear this more. Come on, bring it."
neu," Like this, right now we're trying have a conversation."
neu, We're trying to have a conversation and you seem extremely hostile. You keep cutting me off.
neu, I can't finish the sentence with you without you jumping in...
neu, ...and you're always right.
neu, You have an excuse for everything.
neu, I'm just saying that maybe you should take in some information before you produce more of your own.
ang, I'm like a sponge I'm like soaked up with all this information for like three years I'm just dying for a job to like put it in to.
neu, [BREATHING]
neu," Well, what kind of field are you looking to go into?"
neu, That's it.
neu, Can I help you?
neu, I need a little more information.
neu, What- What flight did you come in on?
neu, Georgia?
neu," There's no need for you to raise your voice, sir."
neu, I've been college educated.
neu, I speak your language.
ang, Are you insinuating that I don't have a college education and that- for some reason that makes you a better person than I am?
ang," Listen, shut your smug mouth, okay?  I don't need that."
neu, I'm just saying you don't need to talk to me like I-
ang, I've been sitting here for four hours.
ang, You people have just been tossing me around like a used hanky.
ang, You work here.
neu," Details, Details.  Well, anyhow can I--"
neu, so you flew in from Atlanta...
neu, Four...Four hours ago.
neu, Do you have any i-?
neu, I wouldn't let you?   I was not in Atlanta. I was not in Atlanta.
neu, I had nothing to do with the boarding attendance.  I'm sorry that your seat was wherever it was.
neu," I have some unfortunate news, uh, that your bag isn't going to be--"
neu, --arriving any time soon.
neu, I'm really sorry to tell you this but...
neu, Okay.
neu, It's not.  I can offer you fifty dollars and a reimbursement gift cards for our airline...
neu, ...and your future...
neu, No.
neu, Yes.
neu, We've actually...
neu, They do as matter of fact.  We don't like to publicize it because
neu, people wouldn't Fly our airline.
ang, Probably people that work for your company huh?
ang, Do you know what was in that little bag that I could have just easily put in overhead compartment but no I had to check?
neu, What was that?
ang, My computer which has all of my data which I'm collecting right now.
neu, That's unfortunate.
ang, Yeah it's really unfortunate you know why because I'm going to get fired if I don't get that.  So I need to have that back.
neu, That's too bad.
ang," Fifty dollars is not going to cover me for my job, okay?"
neu, I wish I could give it to you.
ang, Well you need to find it. Can I just go back there and look through the bags?  Can I just go back there and just go through maybe I'll find it.
neu, I wish I-
neu, That's not - no.
neu, No.
ang, It'll be a lot more than what you're doing sitting here and just give me lip service.  I'd like to go back at least do some aggressive searching for my stuff.
neu, We have plenty of aggressive searching going on it's not there.  Someone's taken it.
ang," Sure, yeah right you have plenty of aggressive searching going on, aggressive searching, drinking coffee and smoking cigarettes."
ang, I know what you guys do when you're not working you're union people; you just sit around on your ass.
ang, Thank you very much.
neu, You okay?
sad," Yeah, I'm just-- yeah"
sad," Just kind of feel numb, you know."
neu, What's happened?
sad, You didn't even hear?
sad, [BREATHING] Umm.
sad, God I've told this story so many times. Umm.
neu, You don't have to if you don't want to.
sad, I just...I just basically lost someone that was really close to me.
sad," And I've kind of been dealing with all of the...the stuff, you know the hospital and people work because..."
sad, I'm sorry to hear that.
sad," He kind of didn't have anyone to take care of that for him, so--"
sad, You've been taking care of it all?
sad, Oh Jesus.
sad, It's just really...really messed up.
sad, He sick for awhile?
sad, No.
sad, Just like it.
neu, Was it an accident?
sad," No, I mean it just came on really quick, you know I mean it was a [GARBAGE] it was a sickness but it just --"
neu, how was sick?
sad, What?
neu," Well, I'm confused.  He was sick or it was an accident?"
sad," He was sick. He got sick. He got sick but it happened really, really fast, you know."
neu, Oh. Really fast? Oh.
sad, It was kind of like boom... done
neu, Yeah.
sad, It's just really weird because he was really young you know and it kind of like...
neu, Yeah.
sad, --it just kind of freaks you out.
neu," Totally, yeah."
sad, So weird you know that like one days it's like you know sounds so stupid but like one day someone's here. And like next day you know they're not here and it just kind of makes you like think about like life and mortality and like that kind of stuff.  You just like used to take for granted--you know.
neu, Mmhmm.
neu, Lock
neu, Mmhmm.
neu, The plans you make [GARBAGE].
sad," Exactly, you know, and like he had so many plans and he was going to do..."
neu, It leaves a hole for you too.
sad," so many things, you know?"
neu," It leaves a hole for you too, in your plans together."
sad, What?
sad, Yeah.
neu, It gets better.
sad," He was a really, really good guy."
neu, Mmhmm.
sad, A lot of people loved him.
neu, MMhmm.
sad," You know, it's like affecting a lot of people it's not just me, you know?"
neu, Mmhmm.
neu, How long did you know each other?
sad, Umm...
sad, For like eight years.
neu, That's a long time.
sad, Yeah.
neu, It's good that you were there.
sad," Yeah, I'm glad I was there. Glad I- glad I got to be there."
sad," So weird,"
neu, Yeah.
sad," like I can't...it's like you know it's like ""pinch me"" it's like I can't believe like I'm dealing with this, you know."
neu, Are there things you wish you'd done differently?
hap, Check this out.  You know how I've told you I've been really into like softball recently?
neu, Yeah.
hap," Well, this is totally random, I got this full ride scholarship to go to U.S.C next year to play softball."
hap, [LAUGHTER]. For softball? That's unbelievable. Is it slow pitch?
hap, For softball.  They're going to pay me to go to school. Isn't that awesome?
hap," Yeah.  Well, I don't--well yeah I can pitch, I'm not like the pitcher though. I'm like the pinch hitter guy I mostly just hit.  But I guess I'm going to have to... Yeah, and then I play shortstop too but... It's so ex- The good news is I get to stay here."
hap, Pinch hitting softball.
hap, That is incredible.
hap, That's amazing. They pay for everything?
hap," I know. For softball, yeah."
hap," Your housing, books, everything? That is incredible."
hap," Yeah, everything. Every like- free ride and I get to, you know, like be on like a Trojans sports team too. And it's like cool. Isn't it awesome?"
hap, That is incredible. Do you get like a per diem?
hap," I don't know. I should ask. Yeah, I will."
hap, You should...You should look into that.
hap," That is amazing, congratulations. Good for you."
hap, Thank you.
hap, But I don't know I want to live in the housing that they give me though 'cause I think I want to you know like get like a nicer place.
neu, Oh.
hap," Yeah, that you probably. You should see one of these Victorian houses around by."
hap, Where should I move?
hap," That's a really good idea. Or I could go to like Santa Monica. Go beach. Venice beach, yeah a little dirty though. I don't want to go to Venice beach. But - Malibu. All right."
neu, Oh. Venice beach.
hap," Oh, you don't like that. You're west-sider?"
hap," Okay. That would be way too much of a commute you can't do that. Especially- I know especially from--I don't know, what I was going to say, I don't know."
hap, Professional softball player Malibu. [LAUGHTER]
hap, I don't know. Commuting from what Malibu that would be ridiculous.
hap," Oh yeah, that would be.  Well, depends on what type of car you had, though too. I guess it would be worth it. helicopter. Yeah, helicopter.  There is a helipad there, right? Yeah, exactly."
hap, Oh yeah. He'd drop you right off at practice?
hap, They have those neon--softballs.  They're like day-glow you can see them anywhere.
neu, Oh. That is incredible. Is it--
hap," do they have a--is it a co-ed softball team?  I mean... Really? You know, I didn't even know that they have that."
hap, They do it's--believe me it's huge.
hap, Who do you play? Like do--are you like... nationally ranked?
hap, I just got into it. I just kind of fell into it. Literally I was walking around and...
hap, That is unbelievable.
hap, It's pretty wild.
hap, I would put that right up there with--ping-pong.
neu," Yeah, well I doubt [GARBAGE] ping pong [GARBAGE]"
hap, I mean not to denigrate what you are doing.  I think that's great.
hap," No, no.  I love softball. I played softball all the time."
hap, I am not saying you should be. I'm not no. I think it's great I think you should be incredibly proud yourself especially because you're going to U.S.C for free for doing it. For free.
hap, For free that's really what it's about. I mean who cares I mean if I have to play softball all the time?
neu, Yeah we have like away games and stuff.
neu, But you know I'm like [GARBAGE].
hap, You're like the rookie? The new kid.
hap, Just watch in five years you'll be like on the force. You carry around donuts in your back pocket... [LAUGHTER]
hap, I'm going to have a mustache...On the force...
hap, Pull over..
neu, He saw it.
neu, I was out here at four this morning I heard a crack and I looked out the window and he was standing right over there.
sad, I don't know.  But he went back in the kitchen and he cried.
sad, Did you talk to him?
sad, No.  I figured I'd just let it wait.
sad, Cried hard?
sad," Yeah, I could hear him crying through the floorboards in my room."
sad, [BREATHING]
sad, I don't know.
ang," He's dreaming about him again, walking the streets."
sad, I guess he is.
ang, What do you mean a mistake?
ang," What, can you prove it?  What proof do you have?  Can you prove it?"
ang," To you it is, to me it is.  But to your father?  You can talk yourself 'til you're blue in the face but there's was no grave and there is no body.  So where are you?"
ang, The trouble is those god damn news papers.  Every month some boy comes back missing longer then Larry so--
ang, Why?
neu, I'm going to ask her to marry me.
ang," Well, what do you want me to do?  You're old enough known your own business."
ang," See.  Then it's not just my business. Sometimes you infuriate me, you know that?  You know it's just your business too if I tell father and he throws a fit about it, huh?"
ang, I'm sorry.  I ignore what I've got to ignore. That girl is Larry's girl.
ang, She is not Larry's girl.
ang," From father's point of view he is not dead and you have no right to take his girl.  I'm just saying that you can go on from there if you know where to go but I'm saying I don't know where to go.  See, I don't know."
neu, You're a considerate fellow.  There's nothing wrong in that.
ang, To hell with that.
neu, Did you ask Annie yet?
sad," No, I wanted to get this all sorted out first."
ang, I don't see why it has to be Annie.
ang," That's a good answer but it doesn't answer anything.  You haven't seen her since you went away to war, it's been five years."
sad," He thinks he's coming back, Chris.  You marry that girl you're pronouncing him dead."
ang," Do you know what that'll do to you, to your father, do you know?  I don't."
ang, Are you crazy?
ang, You have a business here.  I said what the hell is this?
ang, Business?  The business doesn't inspire me.
ang," Oh, must you be inspired."
ang," Yes, yes I like it for one hour a day.  I don't care if I have to grub for money all day long when I come home I want it nice, I want a family, I want to kids and Annie is in the center of that."
neu," Yes, on this I would."
ang," Well, you don't want to think like that."
sad, Then help me stay here mom.
ang," All right but you don't think like that because what the hell is this all for.  This is all for you, what are we working for Chris? The whole shooting match is for you."
sad, Then help me stay.
ang," Well, you don't think like that."
ang, I am thinking like that.
ang," I don't understand you, do I?"
sad," No, you don't.  I'm a pretty tough guy."
ang," Well, I can see that."
ang, Why did he invite her here?
neu," Well, maybe he wanted see her."
ang, It's been three and a half years.  Why all of a sudden?
neu," Well uh, He grew up next door to the girl, why wouldn't he want to see her?"
ang," What is going on here, Joe?"
ang, The girl is not Larry's.  If the girl is Larry's girl she's not his she know she's not.
neu, And how do you know why she's waited.
ang," I want you to---act like he is coming back.  Don't think I haven't noticed you, both of you since Chris invited her here.  I won't stand for any nonsense."
