EMOTION,TRANSCRIPTION
neu," the top of the line camera phone, game boy, anything you want. For free. And palm pilot."
neu, They might only have orange.
neu," Okay.  They can figure out pink for you.  So go in there and just tell them that and they'll hook you up with other goodies, stuff like that free service, no contract, no nothing.  Just for being a good customer"
neu, and battling through with us.
neu," Alright. Well-  I guess - I guess that's okay but,"
neu, Yes.  You just tell them Brent Backersen sent you.
neu, Okay.
neu, Alright?  Great.  Have a nice evening.
neu, Alright Thanks.
neu, What's he going to say?  Maybe we ought to talk to him before he sees it.
sad, He saw it.
sad, He was out there when it happened.
sad, About four in the morning.  I heard a crack and I looked out and he was standing right there when it happened.
sad, I don't know. But after it cracked he ran back into the house and he cried in the kitchen.
sad, Did you talk to him?
sad, No.  I figured the best thing to do was leave him alone.
sad, He cried hard?
sad, I could hear it right through the floor.
sad, I guess he is.
sad," He's getting just like he did after he died, you know?  What, what, what's the meaning of this?"
sad," I don't know.  But I know one thing mom, we made a terrible mistake with dad."
ang, You know that Larry's not coming back and I know that too.  Why we both go on letting him think that we both believe with him.
ang," Why shouldn't he walk around and dream at him at night.  Walk around.  Why shouldn't he walk around?  Why shouldn't he dream of him, walk around at night waiting for him?  Do we contradict him?  Do we say flat out that we don't have anymore hope?"
ang, That we haven't had any hope for years now?
ang, No.  It's his god damned newspapers is what it is.  Now every month there's a new boy comes home and Larry's going to be the next one.
neu," You know why I asked Annie here, right?"
ang, Why?
neu, I want to ask her to marry me.
ang," Well what do you want me to do?  I mean, you're old enough to know your own mind."
neu, Okay.  So then it's alright.  I'll go ahead with it.
neu," Well, I mean, you got to make sure your dad's not going--"
ang, Oh see then it's just not my business. God you infuriate me sometimes.  Isn't my business too if dad throws a fit?  Huh?  God you have such a talent for ignoring things.
ang, Well to hell with that.
neu, Did you ask Annie yet?
neu, I wanted to get this settled first.
neu, Then I guess that's the end of it.
sad, But from her letters I think she's forgotten him.  I'll find out.
neu," And then we'll thrash it out with dad right?  Mom, don't avoid me."
neu," Look, you never had seen many, many women.  You know?  I mean..."
sad, I've given it three years of thought and I thought that if I waited then dad would forget about Larry and then we could have a regular wedding and everything happy.
neu, But if I can't have that here I'll get out.
neu, I'll get out.  I'll marry her somewhere else.  Maybe New York.
ang, I've been a good son too long.  A good sucker and I'm through with it.
ang, You're just going to leave the business?  You have a business here.  You can't do that.
ang, The business doesn't inspire me.
ang, Yes.  I like it an hour out of the day.  If I have to grub for money all day long at least at evening I want it beautiful.  I want a family.  I want a wife.  I want some kids.  I want to build something I can give myself to.
sad, Tell me something.  You can leave this business?
neu, Yes.  On this I would.
ang," I mean what the hell have we worked for then?  I mean, it's all for you Chris.  The whole shooting match is for you."
sad, I know.  Just you help me stay here.
sad, I am thinking like that.
sad, I don't understand you do I?
sad, No you don't.  I'm a pretty tough guy.
sad, Yeah.  I can see that.
ang, Why did he invite her here?
ang, Well she's been away for three and a half years in New York and suddenly she just shows up.
neu," Well maybe, maybe he just wanted to see her."
neu, Who said he even thought about that?
neu," Well, so what?"
ang, No.  She's not his girl Joe and she knows that.
neu, How do you know why she's waited?  Hmmm?
ang," I mean, her faith is stronger than a rock."
sad," My worst times I think about her, you know, and I"
sad, it's like I know as long as she's waiting I'm right again.
ang," No.  Nobody in my house better dare and challenge her faith.  You know and maybe strangers but not his father, not his brother."
ang," Laugh, laugh at me but I will.  Because you know what happened when she came here?  When she came back she slept in his room, the memorial broke into pieces. Joe, look. Look at it. You got to believe with me."
sad," Look, it was just last week that Detroit, some boy came back he had been away longer than Larry, you can read it for yourself. You above all people have got to believe."
ang," Alright, alright, calm yourself okay?  Calm yourself. Wait, wait.  What do you mean, me above all?"
ang," Wait, what does that mean?  Me above all?"
ang," Look at you, you're shaking."
sad, I can't help it.
ang, What do I got to hide?  Huh?  What the hell's the matter with you Kate?
neu, You're not sorry you came?
sad, No.  I'm not sorry.  But I'm not going to stay.
sad," Look,"
sad," you saw the way that she acted and then well, I mean, you, you were acting kind of..."
neu, What?
sad," Well, I don't know, embarrassed of her since I came."
hap," I mean, that's the reason why I asked you here."
hap," Well,"
hap, I love you.
hap, I guess that's why I came.
hap," Look, I've been ready for a long, long time now."
hap," Look, I almost got married two years ago."
hap, You started to write me.
hap, You felt something that far back.
hap, Every day since.
hap," I was waiting for you Chris, I mean, till then you never wrote and then when you did what did you say?"
hap, You'd always be so ambiguous.
hap," Give me a kiss Ann, just give me..."
hap," Oh God.  Annie, I kissed Annie.  I kissed Annie."
hap, I'll never forgive you for that.
hap," I mean,  Why did you wait all these years?  There I was sitting around and wondering if I was crazy for thinking about you."
hap, We're going to live now.  I'm going to make you so happy.
hap, Not like that you're not.
sad," Nothing.  Hey, let's drive somewhere.  I want to be alone with you."
sad, You remember overseas I was in command of a company?
sad, Well I lost them.
sad, How many?
sad, Just about all.
sad, Geez.
sad, Takes a little while to toss that off cause they weren't just men.
sad," For instance, one time this...it had been raining several days and this one kid, he came up to me, he gave me his last pair of dry socks, put them in my pocket."
sad," That's just a little thing but that's the kind of guys I had.  They didn't just die, they killed themselves for each other and I mean that exactly."
sad, A little more selfish and they'd still be here today.  And I got this idea watching them go down.  See everything was being destroyed but there was one new thing that was being created.
sad," It was a kind of responsibility, man for man.  You understand me?"
sad, And to show that and to bring that onto the earth again like some sort of monument standing right behind all of us and we could feel it and it would make a difference to him.
sad, And then I came here and it was incredible.  There was no meaning in it here.  The whole thing to them was a kind of bus accident.
sad," And I went to work with dad and that rat race again and I felt what you said, ashamed.  Somehow because nobody was changed at all."
sad," It seemed to make a sucker out of a lot of guys.  I felt wrong to be alive.  I felt wrong to have that new checkbook,"
sad," open that new bank account, drive the new car and see the new refrigerator"
sad," cause you can take those things out of the war.  But you got to know, when you drive that car that it came out of the love that a man can have for a man and you got to be a little bit better because of that."
sad, Otherwise what you have is loot and there's blood on it.
sad, And I didn't want to take any of it and I guess that included you.
sad, And you still feel that way?
sad," that includes me too, I mean and the money, you have right to that money.  Your father put planes up in the air, good planes and he deserves it, you should be proud of that.  A man should be paid for that."
hap, Annie I'm going to make a fortune for you.
hap, What am I going to do with a fortune?
hap, Buy some hats?
hap," Hey, what time is it?  This pokes around midnight right?  God this is great isn't it?"
hap, Look at the night we got.  I wouldn't trade this for anything.
hap, You know actually I wanted to go a little further up the coast and get away from all the lights and people but I was afraid you'd miss it.  How are you doing?
hap," Is that, is that, nah, is that just Paul?  I can't even tell."
hap," But if I can't tell, it probably isn't them isn't it?  Probably would be unmistakable wouldn't you think?  How are you doing?"
hap," Oh, you know what I forgot?  I forgot my flashlight.  How could I be so stupid?  I should've brought my flashlight."
neu, Yes.
hap," God.  Oh, you know what would be good right about now?  A six-pack.  A six-pack would be just the ticket."
hap," I'm so stupid, I should've brought a six-pack.  God, I'm like a little kid.  It's amazing I get out of the house with my fly zipped up. Oh- [LAUGHTER]"
hap, I wonder if they can hear us talk?  Or feel the vibrations in the sand when we move around?
neu, Do you want my jacket?
hap," Honey, this is a natural phenomenon.  It only happens once a year.  I mean think about the people in Kansas, they would have to get hotel reservations and plane tickets to come and see this.  We're only forty minutes away.  This is too good to pass up."
hap," Well this is like the highlight, the one night of their lives and that flopping around, that's laying eggs or spawning or mating or whatever you call it."
hap," But this is the big night for these guys.  Their last, life's last orgy."
hap, Yeah they do.
hap," Okay.  But it's fish that do something that no other fish do.  Like the swallows in Capistrano or the Lemmings that throw themselves off the cliffs, there's magic here and some mystery and a little bit of unexplainable."
neu, I'm just not.
hap," Look, is that...no is that just seaweed?"
hap," You know, this is great isn't it?  You know, I wouldn't trade this for anything."
hap," I mean, think about this, I know you're not interested but just think about this for a minute."
hap," Somewhere out there, there's this huge silver mass of fish heading this way, they don't why, we don't know why, they just some little instinctual fire cracker went off in their bodies..."
hap," ...like and they all just turned at once and formed a line as long as the California coast and started swimming this way.  They didn't, you know, they didn't make a decision, they didn't, you know, have boats or anything.  No one sent them an invitation or a map, they just started swimming as if that's the only thing that matters."
hap," It's single mindedness with no mind.  It's urgency that's pure urge and they don't, they don't ask it a question, they don't give it a name, they just swim."
hap, They just start swimming to this place right here where we stand for massive celebration of sex and death.
hap," Oh, I'm giving myself goose bumps.  Look, all my hairs are standing up."
hap, [BREATHING] So what do you think?
hap, About what I just said?
hap, So what do you think?
ang, About what?
ang, It's ridiculous.
ang," It's PR.  I mean, somebody sold you a good bill about this wonderful event that going to happen on the beach."
ang," Yeah.  Everyone else was sold the same thing.  I mean, look, it keeps us excited, it keeps us coming back for more and you know, keeps us thinking life's going to start any minute now."
ang," Look, I'm sorry but it's still just fish to me."
ang, Okay.  Twice is as many times as we've tried and that's ever.
ang," Augie, god dammit, don't ask me that.  You always ask me that.  I hate it when you ask me that.  It's insulting."
ang," Listen, I've waiting my entire life on this beach just standing there waiting for this fish to show up and these fish never show up."
neu," Well, we're going to see it."
ang," No we won't.  I mean, God, this isn't about the fish Augie."
neu," Let's see I took a shower, you were watching the news, you said hey, hey the Grunions are running tonight and I said great let's go, I feel lucky tonight."
sad, We thought I was pregnant.
neu, Wait a minute.  I've got it.
neu, It was in the car right?  Driving past the Knickerbocker Liquor Locker...
neu, And you said let's get some champagne and I said time's a wasting or something like that.
neu, You want this to be like the other time right?  That's it right?
sad, I'd rather not remember something...
sad, Rather not hope for something.
sad, No.
ang, I want things to turn out the way that they're supposed to be.
ang, Welcome to the human race.
ang, Do you think that this is what I had in mind?  That four years down the line that we'd get married and come to the beach and argue with each other over fish?  No.
ang, I was just like you.  I thought it was going to be all peaches and roses and everything great and the sand in our toes and the wind in our hair and the fish will always come and the bills will pay themselves and we'd have three big fat rosy kids...
ang, ...and you know?  Baby the jokes on us.  Because you know what you get?  Do you know what you get Carla?  You get this.
ang, Yes it is.
ang, Right.
ang, Cause everything isn't anything like I thought it would be.
sad, This is just this.  You know?  I mean it's a lot and everything but it isn't somewhere else.  Do you know what I'm trying to say?
sad, I know you are Augie.  I know you wanted this evening to be nice.
sad, I can't help thinking about being somewhere else.
sad, Maybe if you were with someone else too.
sad, I didn't say that.
sad, I know.  But I know I don't make you happy.
sad," Augie, whatever I'm doing I'd rather be doing with you."
sad, If anybody wants to be with anybody else it's probably you.  Probably somebody who enjoys herself a little more and is not so hard.
sad," Well, I guess this is the wrong spot for the right people."
hap, I mean look at the view of the moon we got from here.
hap, Yeah.  I noticed that.  It's real pretty on the water.
hap," Hey, look what we got here."
hap, Oh you brought refreshments.
hap, No I'm beginning to think you might be right.
hap, I think this may be the place for us after all.
hap, I am sorry Augie.
hap, Shh.  If we're very quiet the fish might come.
hap, Or not.
hap, Or not.
hap, Now and always sweet.
hap, I don't care then.
hap," I mean, it was, it's bound to come out sooner or later."
hap, That sent shivers up my spine.
hap," No, wrong number."
hap, Behave exquisitely.
sad, That's serious enough.
neu, I didn't hit you very hard.
neu, Yes.  The real cause of that rile was Peter Burden.
neu," Oh, come on, you knew there was nothing in that."
ang, Presents?  A trivial little broach.
ang, You went out of your way to torture me over Peter Burden.
neu, No I didn't.  You made up the whole thing in your jealous imagination.
ang, You must admit he was in love with you.
neu, Just a little perhaps but nothing serious.
ang, You let him kiss you. You said so.  What of it?
neu," Well it didn't harm him, in fact, it pleasured him a lot and it didn't hurt me."
ang, And what about me?
ang," Oh, that's a nice point of view I must say."
ang," Yeah, so am I.  Bored stiff."
neu, You want some brandy?
neu, I'll have a little I think.
ang, I don't know why you want it.  You've already had two glasses.
ang, No particular reason.  Anyhow they were very small ones.
ang, I don't see what you have to go on and on with this kind of thing.
ang, Oh my...just because I just...okay...
neu, It's become a habit with you.
ang, You needn't be so grand just because you don't happen to want any yourself at the moment.
ang, What?
neu," No, just making myself beautiful for you."
neu, That's the woman's job to lure the man.  Watch me a moment won't you?
neu, Actually that's perfectly true.
neu, Yes it is.
neu, I think that
ang," Adders don't snap, they sting."
ang, They sting.
ang, Mind your business.
ang, You're quite insufferable.  I expect it's because you're drunk.
ang, I'm not in the least bit drunk.
ang, You've always had a weak head.
ang," Okay, like I mentioned before I had three very small, minute liquor glasses of brandy.  That's not even enough to get a child of two drunk."
ang," On the contrary, a child of two can get violently drunk off just one glass of brandy."
ang," Oh, what an interesting topic.  What about a child of four and a child of six?  A child of nine?"
ang, Shut up.
ang, We might be able to bring up a splendid little debate about this intemperate tots.
ang," Not very funny dear.  In fact, maybe you better have some more brandy."
ang," Oh, thanks.  I think I will."
ang, You better turn that off.
neu, They are away in Tunis.
ang, No I'll do no such thing.
ang, Very well.  If you insist on being a boorish and idiotic.
ang," Come on, turn it off.  It's driving me mad."
ang, You are far too temperamental.  Try to control yourself.
ang, Turn it--Turn it off.
ang, Go away.  Go away.  I hate you.
ang, Very amusing indeed.
ang," I hate you.  Listen I'm sick and tired of listening to you, you sadistic bully."
ang," You know what?  You're a vile, little, evil-minded, little, wicked beast and I never want to see you again."
ang," This is the end.  Understand?  This is the end, here and now, forever and always."
ang, You're not going nowhere. No you're not.
ang," Oh, yes I am. Yes I am and you can't stop me."
ang, Just shut up.
ang, shut up. shut up.  I would-I would never marry you again if you came crawling back to me on your hands and knees because you're an evil-minded little vampire and I hope to God I never see you again.
ang," Listen, you're a cruel fiend and I hate, loathe you.  Thank God finally, finally thank God I've realized just how horrible you are--and marry you?  Marry you?  Never. I will never marry you.  I will die die in torment-"
ang, Beast. Brute. Cad. Swine. Beast. Beast. Brute. Devil. Sorry.
ang, Oh.
