EMOTION,TRANSCRIPTION
neu, Excuse me.
neu, Yeah.
neu, Is there a problem?
neu, Well what's the problem?  Let me change it.
ang, That's out of control.
ang, I don't understand why this is so complicated for people when they get here.  It's just a simple form.  I just need an ID.
neu," Clearly.  You know, do you have like a supervisor or something?"
ang, Yeah.  Do you want to see my supervisor?  Huh? Yeah.  Do you want to see my supervisor?  Fine.  I'll be right back.
sad, Did you get the mail? So you saw my letter?
sad, Yeah.  I know.
sad," I don't understand.  You've already done so much, I don't know why do you have to go back."
sad, I don't know.  I put in that. request too. They didn't...
neu," I guess, you know, everybody has to make sacrifices."
sad," There's people that have given more though, you know?"
sad, I know.
neu," There's babies over there, though, that need mothers."
sad, I don't know how you can be okay with this?  I don't know why you're not-- you're fine with it.
sad," Just, you know, kicking myself."
sad, things just aren't what they seem.
sad, I just don't see why it has to be you.
sad," If not me then, who?"
sad, What am I going to do? Huh?
sad," You'll videotape everything, yeah?"
sad, Yeah.
sad," Maybe you can send it to me, like stream it, yeah?"
neu, Don't you guys have access to computers over there.
sad, Last month--  Yeah.
sad, I just don't know how I'm going to do it without you.
neu, I have to find sitters.
sad, I can't raise a baby by myself.  How?
sad," We've got friends, that's why we moved here, huh?  Because there is a day care down the street."
neu, I know.
neu, And your mother is close by.
sad, I'll send you lots of letters.
sad, And I want lots and lots and lots of pictures.
neu, So what's up?  What's new?
hap, Well Vegas was awesome.
neu, Yeah.  I heard.
hap," And, um, I got married."
hap, Yeah.  In the old town part.
hap, Who did you marry?
hap, Um- Yes.  It was very romantic.
hap, It was at the slot machines.
hap," Uhuh, uhuh.  He won big and he-and he realized that the only thing that would make it better was me as his bride."
neu, He turned to you and was like...
hap, [LAUGHTER] That's really romantic.
hap," Yeah.  Well.  You know, because he's leaving the next day."
neu, Yeah.
hap, But we're going to have a honeymoon cruise.
neu," Does that mean that you're going to get citizenship, too, in- in England or whatever?"
hap, Oh.  I hadn't even thought about that.
neu, Yeah.  But he'll have like a long visa.  Can you go visit then for a long time?
hap, Oh.  Totally.
hap, I guess I'll-  I guess I'll have an internet husband.[LAUGHTER]
hap, Like you need another one of those.[LAUGHTER]
hap, Is that your phone?
hap," Yeah, so [LAUGHTER] He's calling me now"
hap, He loves you.
hap," He likes to keep tabs, you know."
neu, How much did he win at the slot?
neu," Uh, I think seven hundred and fifty dollars."
neu, Penny slots. That's what he plays.
neu, Yeah.
neu, I'm a big fan of the Wheel of Fortune quarters. But it just costs so much.  I don't know.
hap, Yeah.  We played Wheel of Fortune pennies.  It's like a giant thing with like-
neu," But the pennies always get you because you end up spending like, you know, fifty bucks."
neu, Fifty bucks. Mmhmm.
neu," like, wait, but it's just pennies.  You're like, wait a minute I'm on to you."
neu, Yeah.
hap, Well so now we're married. We have cat children.
hap, Awesome.
hap, [LAUGHTER] Cat babies.
hap," We renamed Brenda, Lumber Janet."
neu, That's fair enough.
hap, She needs a new name each state that we go into. [LAUGHTER]
neu," Have you tried, uh, Craig's List?"
neu," Uh, what?  Craig's List?  Oh the internet thing?"
neu, Yeah.
neu, I don't know.  Isn't that-- that's all like escort services and things like that.
neu, No.  There's regular jobs on there.
neu, Uh huh.
neu, I'm just saying I have a friend that got a good job on it so I was just recommending it.
neu, He's like a manager for a theatre.
neu, He's like a house manager. Yeah.  It's a good job.
neu, He just...
neu, you know what?  I heard about that job.  I applied for that.
neu, You did?
neu, Yeah.
neu, You've been looking for a job for a long time; that was a long time ago.  Right?
neu, Yeah.
neu, Hmm.
neu, I don't know.  He had a really good resume I guess and--
neu, Yeah.  Do you have a resume?
neu, It's kind of helpful when getting a job.
neu, I just- I mean I call people up and I tell them what I'm good at.
neu, Well maybe we should sit down some time and you can just tell me all the stuff that you have done and I'll write it out.
neu, Yeah.
neu," No.  You can- or you can just bring it in person.  But they need, generally, something to see, you know, what kind of what that you've done, what kind of--"
neu," Yeah.  But the piece of paper helps, too."
neu," No.  But it has an outline, you know."
neu," I know.  Okay.  Well, um. Maybe--"
neu, Yeah.
neu," Okay, yeah.  I would imagine."
neu," Well, sometimes you have to do things that you don't necessarily like to do to have a job. But the job affords you money, you won't have to be taking the bus right now."
neu, maybe get a car.
neu," I just, you know, think you should try a little harder maybe."
neu, I didn't say that.
neu," I am riding the bus, but by choice."
neu," To save the environment, carpool."
neu, Yes.  One less car at a time.
neu, Mmhmm.
ang, I'm not frustrated.
ang, Who do you think you are?
neu, I don't think I'm anyone.
ang, You are so high and mighty.  I just--
neu, I- I-I didn't-- okay.
ang, Oh.  I'm saving the environment. I'm riding this car because I- I want to.
ang," The bus, I'm riding the bus because I want to."
ang, I can not-- you are not here by choice.  Nobody would ride this bus by choice.
neu, Hi.  Thanks for waiting.
hap, Can I help you?
hap, Uh huh.
neu, Okay.
neu, Okay.
neu, Okay.  Great.  I'm really sorry that you had to do that.  What's your last name?  Let's start there.
neu, Okay.
neu, all right- okay.  And you lost your bag? Is that- that the issue?
ang, Flight seven fourteen.
neu, Uh-huh.
ang," Am I going to be getting, like, free tickets, free mileage. When can I expect my bag here?"
neu," Yeah. Yeah, I don't see- I don't see any--"
neu," I don't see any record of it, and I-usually when I don't see a record of it, that means um-"
neu," we've mistakenly lost your baggage.  We're very sorry.  On behalf of Jet Blue I would like to apologize for any inconvenience.  I am allowed to issue you a fifty dollar gift card which you can use any future flights you want to take with us.  I'm very sorry, once again..."
neu," for such an inconvenience and your bag, but"
ang, Is this a joke?
neu, Yeah.
neu," No, no."
ang," Are there candid cameras?  Is this that movie? There's that show, right?  Airplane, airline."
neu," No, no.  This is real."
neu," No.  I'm just giving you money, the bag is gone.  If it's not here, I'm really sorry there is nothing I can do because..."
neu, this is the only track record that we have and if it's not listed here then it's probably not anywhere.
ang," You're kidding me, this is a joke."
ang, Do you have any idea-- fifty dollars?  That's supposed to replace everything that I have?  Do you understand how much I have packed in there? Not only does it have sentimental value; it can't be replaced like that.  It was incredibly expensive.
neu, Yes.
neu, I know.
ang, We flew in from Paris.  I've been shopping for three weeks.
ang, I don't care what you're freaking sign says.  Somebody- Somebody needs to replace everything I've got there and give me money for my inconvenience.
neu, Okay. Calm-
neu," Actually, we are not necessarily liable to give you- to even give you this fifty dollars so... it's actually- it's actually really"
ang, Do you understand who my husband is?
ang," If you're- if you're- if you're looking for a lawsuit, baby, you've found it."
neu," We are actually not even allowed--  you know, like we don't have to give you this fifty dollars.  We don't have to do that."
ang, Oh-Oh.  It's a gift.  You're-You're helping me out here?
neu, It's a gift.
neu," You know, the airlines can not be held responsible for every bag of luggage that comes through here."
ang, You are cruising for a bruising.  You are in so much trouble.
neu, With the amount of--
ang, Who's in charge?  Who is the president of Jet Blue?
neu," Um, actually, I don't know. I don't know. Oh really?"
ang, Because I probably know him.
ang, Yeah.
neu, Well then maybe you can just call him and he can give you more money.  But right now all I can do--
ang," I don't want money, I want my clothes."
neu," Right now all I can do is just give you this fifty dollars, I'm really sorry."
ang, What's your name?
neu, Oh.  My name is Sean. Hi.
ang, Okay.  I'll do that.
ang, I don't think you have done everything you could do because I don't have my bag here yet.
neu," If you want, you can write a letter.  I can give you the address. Yes.  An angry--"
ang, A letter? I'll make a personal phone call.
neu," Or you can make a phone call.  But I think a letter might be a little more-- in my impression, letters have more..."
sad," I'm sorry, Joy."
neu, Is there anything I can get you?  Do you want me to take care of anything for you or...?
neu, ...pick up anything?
sad, No.
sad, You know you are welcome to stay at my house if you want to just check out for a couple days and hang out.
neu, That's sweet.
neu, Thank you.
sad, I went to see her headstone a week or two ago.
sad," I used to go to cemeteries a lot before she died.  I just, you know, I felt like they were urban oasis, you know, there is always this green in the city."
neu, Hmm.
sad, So I was like wandering around before.  It takes forever to find her headstone; I always lose it. You know.
sad, So I was looking at this other one and there was like a piece of candy there and I thought that I would take the candy and put it on her headstone.  And-
neu," this woman came up and, you know, it was hers. It was her person that was there."
neu, Oh.  She was there?
sad," Yeah.  And she was like, that's pathetic, I hope you enjoy it."
sad," And I, you know, I mean, I said I was sorry and I brought it back to her kind of and I like put it on the ground and she was like, no, it's fine.  She was like, I would rather have her back, honestly."
neu, Mmhmm.
sad," I don't know.  It just, like, I felt so bad because I shouldn't have done it.  I don't know.  Whatever."
sad, Yeah.
sad, I don't know.
neu, How long were you there for?
sad, At the cemetery?
neu, Mmhmm.
sad, couple hours.
neu," I brought- I brought Chuck with me. He went to Redlands, yeah, for the day.  We ran through the sprinklers."
neu, Oh really?
neu, You ran through the sprinklers in the cemetery?
neu, Is it a big cemetery?
neu, Yeah.  It's huge.  Redlands is an old city so they have lots and lots of stones.
neu," Oh, so they're like really old too, really old ones?"
neu, Yeah.
sad," It's weird.  Whenever I go back to town, I think of her.  I mean, it's like ... I mean we grew up together and she died when we were twenty one.  And yeah.  She had cancer, she had two brain tumors."
sad," My best friend Heather.  She's got a- we have a- we built this like little--  There's a park, Prospect Park.  And there is like a garden section of it that we set up for her."
sad, She used to have these poetry parties on Memorial Day.
neu, Mmhmm.
sad, Umm. Yeah.
sad," And the last time before she died, I remember she couldn't really stand, umm..."
sad," But I mean she could, but it was- so it was kind of sitting at her feet holding her up and she had these poems she had memorized.  And I remember looking up, she had curly red hair and there was this palm tree right behind her and it was like a crown growing right out of her head.  It was cool."
neu, Mmhmm.
sad," Some, I guess.  She memorized this one, John Dunn, it's called, Death Be Not Proud. and-"
neu, So she wrote a lot of poetry?
neu," There's another one, I can't remember."
sad," I remember, too, when we were--  she died at U.C.L.A.  She had brain surgery and there was not much hope to begin with, but I gave blood for her surgery, her mom and I before, so we dropped her off in the waiting room and then we were giving blood and came back.  And she, in her wheelchair, like can hardly do anything, reciting her poetry for these people like in the waiting room.  All she needs is a God damn audience.  You know?"
hap, Did you get the letter?
hap," Yes.  There's a big envelope it says, you're in. I know."
hap, Yeah. That is so awesome.
hap, Oh my God. What are you going to do? [LAUGHTER]
hap," Oh-Yeah, I bet you're really excited. Oh.  That's what loans are for?  Right? Exactly."
hap," I'm really excited.  Yeah. I don't know how I'm going to pay for anything, but... I also- Yeah.  Loans, too, yeah. I applied, though, for a bunch of grants and scholarships so I'm still waiting to hear on that."
hap," Oh.  Good, good.  That's awesome. Are you going to stay around here?  Or are you going to like get a different neighborhood- you going to move to a different neighborhood?"
hap," Oh- I know, I know, I know, I know."
hap," I don't know.  I spend so much time commuting as it is, I'd rather."
hap, This is so- I am so happy that you're going to stay.  You're not going to...We should totally throw a party.
hap, I know. We should throw a party.
hap, A rapper party ho. Yeah. Okay.
hap," I am just- Yeah.  I'm sticking around, I'm just doing my thing.  I'm living here.  I'm so glad you're going to stay, I'm so glad you're going to be here. Yeah. Woo."
hap, Yeah.  Big time.
hap, Mmhmm. Mmhmm. Yay. So what major?  What are you doing?
hap, Yeah.  I'm not sure.
neu, Is this a Masters or a P.h.D.?  Or can you...? Nice
hap, Umm...P.h.D. [LAUGHTER]
neu," That's good.  Don't you have to like teach a class, too, when you do that?"
hap," Teacher. Mrs. Nash, I have a question."
hap, So I get to mold young minds. Mrs.?  That's my mother.
hap, You have to get married.  Well you are married to Chuck.  You're Mrs. Nash.  Not to be confused with Mrs. Dash which is the popular seasoning.
hap," I would be like- Oh. Right, right, right."
hap, Yay...School's fun.
neu," Of course, right.  That's where the real money is, being a student."
hap, That's how you get the big bucks.  Are you messing with the chair? Don't ruin it.
hap," I know. I made such a mess of it, the entire time.  The last three things I've done, I've ruined everything, I think. Mm-hmm.  Yeah."
neu, He saw it.
neu, He was out here when it broke.
neu, Four o clock this morning.  I heard a crack and I woke up and looked out.  He was standing right over there when it cracked.
neu, I don't know.
neu," He's dreaming of him again, walking around."
neu, I guess he is.
neu, You know Larry is not coming back and I know it.  Why do we allow him to go on thinking that we believe with him?
neu, We've got to say it to him.
neu," Sit down, Mom.  I want to talk to you."
neu, You know.
neu," Well I got an idea, but what's your story?"
neu, I'm going to ask her to marry me.
neu, You know it's not just my business.
neu," So all right then, I'll just go ahead with it?"
ang," You know sometimes you infuriate me.  you know that?  Isn't it your business if I tell father and he throws a fit about it?  God, you have such a talent for ignoring things."
neu, I wanted to get this settled first.
neu," Well if she does, then that's it.  That's the end of it.  From her letters, though, I think she's pretty much forgotten him."
neu, And then we'll thrash it out with father.  Okay Mom?  Don't avoid me.
neu, Just give it some more thought.
ang, What the hell is this?
neu," I'll get out.  I'll get married and I'll move somewhere else, maybe New York."
ang, You have a business here.  What the hell is this?
ang, Oh.  Must you be inspired?
neu," On this, I would."
neu, Then help me stay here.
ang," All right.  But you don't want to think like that because what the hell are we working for, Chris?  It's all for you.  This whole shooting match is for you."
ang, Just don't think like that.
neu, Well maybe...maybe he just wanted to see her.
ang, He's not going to marry her.
neu, How do you know he's even thinking about it?
ang, It's got that about it.
ang," What is going on here, Joe?"
ang, She is not his girl.  She knows she's not.
ang," Then why is she still single?  New York is full of men, why is she still single?  Probably a hundred people told her she's foolish, but she waited."
neu, How do you know why she waited?
ang," Because she knows what I know, that's why.  She's faithful as a rock.  In my darkest moments, I think of her waiting and I know that I'm right."
ang," Nobody in this house dares take away her faith, Joe.  You know strangers might, but not his father, not his brother."
ang," I want you to-- I want you to act like he is coming back, both of you.  Don't think I haven't noticed you since Chris invited her here."
ang, I won't stand for any nonsense.
ang," Because if he's not coming back, I'll kill myself.  Oh laugh, laugh all you like but why does this happen the very night he comes back.  She goes to sleep in his room and his memorial breaks in pieces.  Look at it, Joe, look."
ang," Just believe with me, Joe. Only last week a man came back in Detroit missing longer than Larry.  Believe with me. You, above all, have got to believe. Just believe."
ang," What have I got to hide?  What the hell is the matter with you, Kate?"
neu, You're the only one who still loves his parents.
neu," I know.  It kind of went out of style, didn't it?"
neu, It's not so bad; it's a good thing.
neu," [BREATHING] You know, it's lovely here.  The air is sweet."
neu, You're not sorry you came.
neu," I'm not sorry, no. But I'm...I can't stay."
neu," For one thing, your mother much as told me to go."
neu, Well.
neu," And then, you.  You've been kind of..."
neu, What?
neu, Sort of embarrassed ever since I got here.
neu, Well I was kind of planning of sneaking up on you over the course of a week or so.  They just take it for granted that we're all set.
neu, I knew they would.
neu," Well sure, from your mother's point of view.  Why else would I come?"
neu," I, umm. I guess, I guess that's kind of why I came."
hap, [BREATHING]
hap," I love you. Annie, I love you."
hap, [LAUGHTER]
hap," I don't really have any imagination, that's all I know how to say."
hap, [LAUGHTER]
hap," Am I embarrassing you? Are you - See, I didn't want to do it here with this yard, on this porch.  I wanted it to be somewhere new, some place fresh for both of us."
hap, No. No
neu," Chris, I've been ready a long, long, time."
neu, I almost got married two years ago.
neu, You started to write me.
hap, Every day since.
hap, Why didn't you let me know?
hap, Give me a...
hap, Give me a kiss.
hap, beating around the bush.
hap," I will never forgive you.  All I'd done was sit around wondering if I was crazy waiting so long, wondering if you were thinking about me."
hap," Oh Annie, we are going to live now.  I am going to make you so happy."
hap, Not like that you're not.
hap, I kissed you.
neu," Like Larry's brother.  Do it like you, Chris."
sad," Hey, let's drive some place.  Huh?  Let's get out of here."
sad, No it's nothing like that. It's-
sad, Yeah.  I suppose I have been. But it's going from me.
sad, I don't even know how to start.
sad," It's just all mixed up with so many other things, you know?  You know overseas I was in command of a company?"
neu," Yeah, sure."
sad, Well I lost them.
neu, How many?
sad, Pretty much all.
sad," Aw, geez."
sad, You can't just toss off a thing like that because they weren't just men. You know?
sad," Like for instance, there was this one time it had been raining for several days and this kid he just came up to me and he gave me his last pair of dry socks.  He just put them in my pocket.  That's a little thing, you know, but that's what kind of guys I had."
sad," They didn't die, they killed themselves for each other.  I mean that, exactly.  Just a little more selfish and they would all be here today."
neu, Mmhmm.
sad," To bring that on to the earth again, you know, is like some kind of monument and I thought I would just make a difference to them."
sad," But then I came home and it was incredible, you know?  The whole thing was just kind of this random bus accident.  You know, I went back to the rat race again, I went to work."
sad, And I didn't want any of it. I guess that included you.
neu, I just want you to know Annie.
hap, What would I do with a fortune?
neu, Fine.
hap," Okay.  Is that, is that--"
neu," The flashlight, the silver one.  There's only one, isn't there?"
neu, That's not your flashlight.
neu, Whose is it?
neu," Oh...well. Yeah, of course."
ang, You keep saying my flashlight like it's just yours.
neu, No.
ang, How's that supposed to make me feel?
neu," Of course, our flashlight.  What's yours is mine.  Me flashlight es su flashlight."
neu, Do they always run during a full moon?  I don't remember.  Was it full last year?
neu, Yeah.
neu," Huh.  Are you cold?  Do you want my jacket?  No?  you know, we should have brought the blanket?  Our blanket."
neu," Aw.  Do you know, I should have brought a six pack, too.  A six pack, that would be just the ticket right about now.  Huh?"
hap," God, I'm so excited, I'm like a kid.  I can't believe I got out of the house with my fly zipped up."
hap, [LAUGHTER]
sad, I'm cold.
neu, Right.
neu," Wait, that's my point, too."
neu, Not particularly.
neu, Why not?
neu," Honey, this is like a natural phenomenon. I mean... People in Kansas would have to get plane reservations and get hotel rooms to see this.  It's just forty minutes away for us; it's too good to pass up."
neu, Yeah.  But this..this moment on the beach is like the highlight of their little lives.  All that flopping around is laying eggs or what to do - spawning or mating or whatever.
neu, This is a big night for these little guys.  It's like life's last orgy.
neu," There's like mystery here, there's magic.  It's like a little bit of the unexplainable.  I just can't see how you're not interested."
neu," God, I don't get it.  you know the first time we came here, you said it was the best night of your life?"
neu," And last year, I remember distinctly you said, you were so excited to get here that you don't remember you stubbed your toe until we were in the car."
neu, Ahh...we weren't in a good spot.
neu," We just weren't in a good spot.  I'm telling you, this is a much better spot.  I have instincts for these things."
hap," Look there, see?  What's that?  No, that's - that's just seaweed."
hap," God, this is great.  Think about this.  I know you are not interested, but just think about this."
hap," Just all at once, they turned and they formed this line as long as the California coast.  And some instinctual little firecracker went off in their bodies and they all just turned as one and started swimming."
hap, It's single mindedness with no mind.  It is urgency that is just pure urge.
neu, That's the wind.
hap, So what do you think?
neu, About what?
hap," About all of that, about all I was talking about."
hap," Look at this, all of the hairs are standing up on my arm."
neu, That's the wind.
hap," Well, so, what do you think?"
neu, About what?
neu, About what I was saying.
neu," Carla, can I ask you something?  Now, don't take this the wrong way, but are you on your period?"
ang," Don't ask me that.  I hate it when you ask me that, you always ask me that.  It's insulting."
ang," For God- Grow up, Augie.  The fish are not going to arrive."
ang, Because they never do.  Have they...Have they ever?
ang, Twice is every time we have tried; that's ever.
sad," I feel like I'm always just standing here waiting.  I feel like this night is going to be the night, but it never is."
ang," For God's sake, this is not about fish."
neu," Okay.  So you were fine during that phone call from Marge and then dinner was okay.  And doing the dishes was fine and then I was going to take a shower and you're watching the news and you said the grunions are running tonight, do you want to go?  And I said, sure great, let's go."
neu," Okay.  So I am putting out the pets, getting the car out of the garage."
neu, Do you remember the first year we came here?  It was like four years after we got married.
hap," You whispered the sweetest, most intimate things to me right into my ear so I could feel them as much as hear them.  And I remember thinking, this is it.  You know, finally, I am as happy as I'm supposed to be."
neu," It's when we were driving past that Knickerbocker Liquor Locker, you said, let's get some champagne.  I said no, time's a wasting or something like that."
sad, I'd rather not remember some things.  I'd rather not hope for some things.
neu, Sure.  All right.  Okay.
neu," Listen, do you want to dance?"
neu, No.
neu, Do you want me to go get some champagne?
hap, Do you want to take off your shoes?
hap, Do you want to get married again?
neu, No.
neu, Yes it is.
sad," I know you are Augie, I know."
sad," I know you meant this to be special, I know that you wanted it to be right, but I just can't help thinking that, I can't help wishing that I was somewhere else."
sad," Maybe if you were with someone else, too."
sad, I didn't say that.
sad, I just- I know I don't make you happy.
sad," You're the one who probably wishes he was with somebody else.  Somebody who doesn't take things so seriously, who could enjoy herself."
neu," You know, actually now that you mention it, no I don't."
neu," So maybe we are in the wrong spot, but we are with the right person."
