EMOTION,TRANSCRIPTION
sad, We thought I was pregnant.
sad, You brought a bottle of champagne.
hap, We took off our shoes and we danced barefoot in the sand. Under the moon.
hap, And you whispered so intimately in my ear so I could feel your words.
hap," Oh, that moment-that was it."
sad," I told myself finally, this is how happy I'm supposed to be."
neu, Wait a minute. I got it.
hap, Dancing barefoot in the sand. Drinking out of a bottle of champagne.
sad, I don't want to remember something.
sad, Hope for some things.
sad, No.
sad, No.
sad," No, no."
ang, No.
ang," A-a back rub, some ice cream, a suicide pact. What the hell do you want, Carla?"
ang," No, it's not. It's standing on the beach waiting and fighting."
sad, Things have never turned out anything the way that I thought they would be.
sad, it's not something else. Do you know what I'm trying to say?
sad," I know you are, Augie, and I know you wanted this evening to be nice, but I can't help thinking of being somewhere else."
sad, I didn't say that.
hap," Actually now that you mention it, no, I don't."
hap," Well, I guess we're just in the wrong spart-spot with the right person."
hap," Seemed like a pretty good spot to me. I mean, look at the view of the moon we've got from here."
hap, I noticed that. It's beautiful.
hap, You can see right over the water.
hap, Look what we got here.
hap, It's not champagne.
hap, At least we won't need glasses.
neu, Are you still cold? Do you want to go home?
hap, Maybe this is the right place after all.
sad," I'm sorry, Augie."
neu, Shh.
hap, If we're very quiet the fish might come.
hap, Or not.
neu, [BREATHING]
neu, Do you think it's them?
neu," We're all right, aren't we darling? Whatever happens."
neu, Then I don't care.
hap," things that should matter dreadfully don't seem to matter at all when one's happy, do they?"
hap, Don't laugh at me. I'm serious.
hap," [LAUGHTER]. You mustn't be serious, my dear one, that's what they want."
hap," Ooh, certainly you must. We're figures of fun, all right."
sad," Oh dear, well, shall we want that?"
sad," Well, what if happens if one of us is to die? Does the one that's left still laugh?"
hap," Let's blow strumpets, blow-blow trumpets and squeakers and party as much as we can like small quite idiotic school children. Let's savor the delight of the moment. Come, kiss me darling, before worms pop in and out of your eye sockets."
hap," Thank you, dear. The same applies to you. Except that if I ever so much as catch you looking at another woman I'll kill you."
hap, Remember that awful scene we had in Venice?
hap, Oh Charles. That was his name. Charles. He did wiggle so beautifully.
hap, yeah. And that was the first time you ever hit me.
hap," That was a rouser, wasn't it?"
hap, The manager came in and found us rolling on the floor and biting and scratching like panthers. [LAUGHTER]
hap, I know. Oh man. Couldn't believe it.
ang," As a matter of fact, the real cause of that row was Peter Burden."
ang, I knew nothing of the sort. You took presents from him.
ang, I remember it well. Bristling with diamonds. In the worst possible taste.
neu," Just a little perhaps, but it was nothing serious."
ang, You let him kiss you. You said so.
ang, What about me?
ang," That's a nice point of view, I must say."
neu," Well, it's true."
neu, Are you bored with this conversation?
neu, So am I. Bored stiff. Want some brandy?
neu," I'll have a little, I think."
neu," No particular reason. Anyhow, they were very small ones."
neu, It's become a habit with you.
ang, You needn't be so grand just because you don't happen to want some yourself at the moment.
ang, Don't be so stupid.
ang," Really, Amanda."
ang, What?
ang, Nothing.
ang," Going somewhere, dear?"
neu," It's a woman's job to allure the man. Watch me, won't you, a minute?"
ang," No, it isn't."
ang," Yes, it is."
ang, They snap.
ang," I don't care. I don't care, do you understand? I don't care if they bark, if they roll over on the floor like hoops."
ang, did you see much of Peter Burden after our divorce?
ang," I imagine that you let him kiss you quite a bit more then, didn't you?"
ang, You had a riotous-must have had a riotous time. No restraint at all. Very enjoyable. You never had much anyhow.
ang, You are quite insufferable. I suppose it's because you're drunk.
ang, I'm not in the least bit drunk.
ang," Okay. As I mentioned before, I said I had three very minute liquor glasses. That's hardly enough to get a child of two drunk."
ang," Well, I suppose the people downstairs then."
neu, This is no time of the year for Tunis.
ang, Turn it on.
ang, Turn it off.
ang, I will not. Go away. Go away. I hate you.
ang," Oh, very amusing, indeed. Amanda, listen-"
ang," Listen, indeed. No, no, no, no. I am sick and tired of listening to you, you sadistic bully."
ang, Very amusing indeed.
ang," Stop it, stop it, I hate you, I loath you, you are overbearing and conceited and utterly impossible."
ang," You know, you're a vile, ill-tempered, wicked little beast and I hope that I never see you again as long as I live."
ang, This is the end. Do you hear? The end. Now and forever.
ang," No, you're not going out like this. No you're not."
ang," Oh, yes I am."
ang," Yes I am. Let go of me. I hate you and I loath you. God, I can't believe I just finally realized how you are. I am never marry you. Never. Never, never, never. I would rather die in torment."
ang," Oh, shut up. Shut up. Shut up."
ang," I wouldn't marry you again if you came back crawling to me on your hands and knees because you're vile. You're a mean, evil-minded little vampire and I hope to God I never set eyes on you again."
ang," Beast or brute cad, swine beast beast brute."
neu, Is that a demand sir?
neu, No.  You filled out the back part.  You were supposed to fill out the front portion only.
ang, What are you talking about?  It says fill out that part.
ang, I'm not going anywhere.  I'm staying right here.
ang," Hey,uh-- Well that's too bad cause I'm getting my license right now."
ang," Hey, no, give me that back."
ang, -- No.  I'm not waiting...I'm not coming back again.  I don't have time to come back five days.
ang, Yes I will.  I'll have this [GARBAGE]
ang, Fine.  Call your supervisor.  Ask supervisor over
ang, No.  I'm not going anywhere.  I'm staying here-- I am filling out right now okay just calm down. I'm filling out right now-- Just take the god damn piece of paper.
ang, Okay.  I'm going to call security. Security!
ang," This entire time you're fighting with me sir, you could've finished the form and already been half way-- No.  Get out."
ang, I did finish one.  Take it.
ang, What is wrong with you?
sad, Hey sweetie.
sad, Hey.
hap, Um.
sad," Uh, -Um"
hap, Why the sad face?
sad, they need me out there sooner than I thought
sad, They want to deploy me next week.
sad, For--
sad, They said anywhere from two to three years.
sad, No.
sad, Do this whole thing by myself?
sad, Honey you're not going to be by yourself--
neu," We'll have internet set up, we'll get web cameras and everything.  My whole family's here too."
sad, Carry her for nine months and then yes.
sad, It's not the same thing.  It's not like having you here.
sad, I can't do this.
neu," You can do it.  Alright?  You can, you can be strong, you can be strong for both of us alright?"
sad, I'm sick of being strong-- --for us.
sad, I don't know what to do.
sad, You know I can't say no.
sad," and watch our child grow, see her take her first steps, her first words."
sad, Honey after a year I can be back.
sad, You said two years.
sad, They want me there two years but I could probably get
sad, maybe get some vacation-- --once it quiets down there.
sad, A whole year? --We're not talking about like a couple months here.  I mean this is a whole year.
sad, I know.  I know.  But they really need some good guys there.
sad, What could happen in a year?
sad, And this isn't the first time you know?  I mean you always...sending you off to different places and...
sad, Well that's the kind of work I'm in honey.
sad, I don't know if that's how I want to live my life.
sad, It's just going to be--it's going to go faster than you think.
sad," Joe I'm serious I don't want to have to have a little girl to tell...asking every day where's daddy, where's daddy and have to tell her that he's away--"
sad, far away and he won't be here.
sad, You tell her-- [BREATHING]
sad, I'm done.  I can't honey.
sad, What do you mean?
sad, It's over.
sad, Honey I can't do it anymore.
sad, I need you here.  Anna needs you.
sad, yeah.
hap, Hey.
hap," Esmeralda, guess what?"
hap, What?
hap, [LAUGHTER] Guess who just got hitched?
hap, This guy. Yeah.  Can you believe it? She said yes too. Yeah.  She said yes.
hap, Okay we were at Chuck E. Cheese.
hap," Chuck E. Cheese?  Ah, man that is so lame."
hap, Are you serious [GARBAGE] man?
hap, Oh like that one movie.  What's that one movie I just saw? No.  Where she like swallows the...
hap," oh, I don't remember.  Everybody Says I Love You with Drew Barrymore...no you haven't seen it?  Okay."
hap, [LAUGHTER] So nasty. No you... dirty me?
hap," Ah...Anyways, so she took the ring and she goes, is this real?  So I was like, of course--"
hap, Sara and I--
hap, She actually asked if it was real?  I would've probably asked the same thing considering you were in Chuck E. Cheese.
hap, Come on. It was her birthday.
hap, She wanted...she always wants something spontaneous.
neu," Yeah.  That's, you know, okay."
hap," I couldn't, I couldn't afford the Red Lobster. [LAUGHTER] What anyway?"
hap," Oh god! You are damn cheap, cheap, cheap. Anyways, moving on. It's not like you're poor.  I mean your dad makes... okey"
hap, So Okay then and.
hap," I got all the character animals to do a conga line,"
hap," dim down the lights and uh, I got on one of the tables pulled her up."
hap, You had the mouse?
neu, Isn't it a rat?  It's a rat.  Chuck E. Cheese?
hap, Yeah.
hap," Chucky...I don't know.  I don't know. Anyways, I pull her up and I go, I go Sarah"
hap," You're my guiding light, then they put on that song the I've had the time of my life, that song."
hap," Okay, that is really cheesy Joe."
hap, Oh that's kind of sweet.
hap," Wait, wait, wait I want you to marry me?  No, shouldn't you like be more like a question like, would you marry me?  Not like I want you to marry me.  It's like a demand."
hap," You marry me. I man I Jane, you Tarzan."
hap, She said sure?
hap, Sure?  Who says sure?  You say yes...I don't like--
hap, How long have you guys been going out?
neu, About two and a half weeks.
hap, Two and ...  We love each other. Yeah.
hap," You got to meet her, she's wonderful."
hap, She just graduated from high school and----she's planning to apply for colleges----and stuff.She's so great.  She has so much life and energy and stuff.
hap, She must be hot.
hap," Yeah, she is good-looking."
neu, I'm twenty eight years old.
neu, You still act like a boy.  And men take a lot longer to grow----I will tell you.
hap, I'm so excited.  It's going to be great.
neu, I'm still working at my parents' restaurant. Busing tables.
hap, Oh that's great. My mom said we can move in with her again if we run out of money.
sad, I'm just so tired all the time.
neu," Well have you been trying to get a job, look for a job or...?"
neu, Well what are you looking for?  I mean--
neu," Well, okay. Well that's--"
ang, Cause I went to Harvard.
sad, Yeah.
sad, Yeah.
ang, I'm smarter than half the people I work for.
hap, Well what'd you major in?
neu, Oh yeah?  What kind of jobs they got?
neu, I am...just like a law clerk.
neu," Well, I'm moving up.  I mean it could be..."
neu, Yeah.  It's alright.  But--
sad, No.
neu," Well... If you need something, I mean, you're just going to---can get a temporary thing right now and then look for something--"
neu," -it's going to get better I promise you. You just got to hang in there. Everyone, I mean, you know?"
sad, Maybe I'll just kill myself.
sad, I was just joking...
neu, You got to be positive man.  You got to try to just--
neu, But you got to be real about it.  You have to...
neu, Sixteen hundred.
neu, Same difference.
neu, Twenty-one hundred?
hap," Like, wow you're really smart we're going to give you an extra [GARBAGE]."
neu, Can I help you sir?
ang, Yes you can help me.  Where is my luggage?
neu," Well, let me just check on that for you.  Where are you coming--?"
ang, Yeah.  You do that.  I'm coming from Baltimore.  You know where that is?
neu," Sir, yes it's in Maryland.  It's okay...well, I'm...just let me check here."
ang, I had eight hundred pounds of luggage.
ang, Okay.  Check.
ang, Is it there?
ang, Yes.
neu, Okay and this is direct flight?
ang, You don't know where we're at?
ang, God.
neu, You're at me and I'm going to try to help you out sir but you just have to cooperate with me--
ang, Okay.  What do you want?
neu, How many pieces of luggage do you have checked in?
ang, Eight.  And they're all gone.
neu, Eight pieces of luggage.  Okay.
ang, And what are you going to do about it?  You going to call someone?  You going to send me somewhere else?
ang, It's my mother's funeral tomorrow and the urn is in the suitcase.
neu, I'm sorry sir.
ang, Yeah.
neu, I'm very sorry but let's check on this immediately.  This is definitely an emergency.  It seems--
ang," Oh, oh, that's a good deduction."
neu, Yes--it is
ang," Sherlock Holmes.  God, where's my luggage?"
ang, Calm down?  It's my mother's funeral tomorrow.  I'm the one responsible for this.
neu," Okay.  We will find your luggage.  Apparently because it somehow...what flight you were taking, you were on Delta?"
ang, What is the matter with you?
ang," Sir, I just...you need to calm down is what needs to happen right now."
ang, Don't yell at me.
ang, Oh my God.  I think a blood vessel burst in my head.
neu," Please, please"
ang, What?
neu, Okay.  We can get it here in about seven to ten business days.
ang, What?  Are you kidding me?
neu," Yes.  Well, because--"
ang, Give- Give me your manager right now.
neu, I am the manager sir.
ang," You're the manager? You don't know where you work for, you don't know where you're at and you're the manager?"
ang, Whose daughter are you?
ang, Sir. Sir. Sir. Sir
ang, What is your name?
ang, My name is Brent Caption.
hap, Now what are you going to do about it?
neu, Can I help you sir?
neu, Okay.  Well let's...well I'm going to go ahead and check on that for you.  You're coming from...where are you coming from?
neu, Baltimore and this is a direct flight to LAX
neu, Okay.  Let's look up here
neu, Okay.  Well you um-...
neu," What I can do for you is uh we can uh report lost, lost property."
neu, Yes.
neu," Well sir, if if...what I believe has happened is most of the flight was left--"
neu, the luggage was left in Baltimore.  Therefore--
ang, Most of the...
neu," Like the luggage, the luggage on the flight."
neu, No actually it was...this is the first time this has ever happened.  I don't know what happened--
neu," Well, we can give you um- hotel lodging for a night if that--"
ang, I'm going to San Diego tomorrow to stay with my family.  What do I need hotel lodging for hmmm?  Can you tell me that?
neu, For tonight- For tonight sir.  Would you need to stay somewhere tonight?
neu, We can do Holiday Inn or...?
ang, Wow.  Thank you.  Holiday Inn.  Wow.  Thank...the flight cost five hundred dollars.
neu, Sir I understand that but just--
ang," Okay, so you can put me in Holiday Inn for twenty dollar a night?"
neu, Did you have your name tags on the luggage?
ang, Of course I had my name tags on the luggage.
neu," Okay.  So if you can just give me your name, your name and your address and your phone number I can contact you as soon as we find out more information."
ang, Soon as you...that's not good enough okay?
neu, What is your business?
neu, I work for IBM.
neu," Okay.  Sir?  I am sorry to tell you this but this does happen. Uh- This is not uh- really,"
neu," I mean, our airline's fault.  I don't know what happened, misplaced, something happened but we will get you--"
ang," You misplace a lot of, eight pieces of luggage."
neu," Well, the entire flight, sir, the luggage was placed on another plane that never actually left Baltimore."
neu, Uh no I'm not.
ang, Are you kidding me?
ang, Who are you going to fire because of that?
neu," Well we have some people back there that need some firing so, but I would just really appreciate--"
ang," Wow.  This has never happened before.  I've not lost,"
ang, in all thousand flights I've been on probably I can't even count how many flights I've been on.  This has never happened before.
ang, This is the worst customer service I've ever gotten before.
ang, Okay.  Get on the phone and figure out where my luggage is and tell me when it's going to get there alright?
ang," And and, in about..."
ang, Can you get it to the San Diego airport?  You get someone to drive it to my place alright? Then I get a refund for some...I get a free flight alright? I get free whatever.
neu," Yes sir, Yes."
neu, We can have them direct your luggage to San Diego.
neu, Uh--
neu, Some refreshments in the lobby?
ang, Some peanuts?  Wow.  That helps a lot.
ang," Thanks you, thank you I don't have my luggage so you gave me a Holiday Inn stay and peanuts.  Wow.  You know what?"
ang, I will never do business with Delta again.
sad, How's it going?  How are you feeling?
sad, I ah--
sad, alright.
sad, Hanging in there?
sad, Yeah.
sad, So sad.
sad, It just feels like I was talking to him yesterday.
sad, Yeah.
sad, You guys were real close huh?
sad, He was my only friend growing up.
sad, no one else would talk to me but he would.
sad, He was supposed to be the best man at my wedding.
sad, I'm so sorry.
sad, Yeah.
sad, You know I was always the one to tell him to be more wild you know?
sad, And he just took it overboard.
sad, What happened?  What went wrong?
sad, You know a stupid case of drunk driving it's just...
sad," and the worst part of it is that he was in the car with his girlfriend,"
sad, his girlfriend got killed too.
sad, Oh man.
sad, And the car that he hit was his family.
sad, How are they?
sad, The mother and father died--
sad, and the kids are paralyzed in a coma right now.
sad, and just going to the funeral it's-
sad," -do I miss him or do I hate him, you know?"
sad, Yeah.  Like I mean if you need anyone to talk to or anything I'm here for you okay?
sad, We're all here for you.
sad, I was supposed to see him last summer
sad, then I got busy with work and stuff and three years go by
sad, and then something like this happens you know?
sad, I mean I haven't even talked to him on the phone for the past three months.
sad, He's supposed to be my best friend.
sad, I know.
sad, just things happen in life and you just...there's just no explanation you know?  We just don't...
sad, It's so fucked up.
sad, Yeah.
sad, I'm so sorry.
sad, Why is that?
sad, He was studying to be a doctor.
sad," I mean he was...he wanted to help people in poor countries, that is his goal.  He didn't care about the money.  He just wanted to go and help people."
sad, What the...what am I doing?
sad, Working for corporate America?  Wow.
sad, He actually wanted to do something.
sad," Well now you can follow his footsteps, you know?  Carry out what he wanted to do."
sad, I can't do that.
sad, Well sure you could.
sad, You should've met him.
sad, He is the greatest...everyone liked him.
sad, Yeah.
sad, I would've loved to.
sad, Now I can't.
hap, Hey.  How's it going?  I haven't seen you in awhile.
hap, What's going on Joe?
hap, Guess who got into U.S.C.?
hap," Me. Yeah, I did."
hap, Yeah.
hap, I got into the...
hap, I got into cinema production.
hap, Yeah.
hap, No.  It's like it's harder than getting into Harvard.
neu, What does that mean?
hap, You're going to be here and I'm going to be in LA so we can be together now.  I mean we can be in the same city.
hap, Holy shit...
hap, We can party.  We can have fun.
hap, This will be like high school but even better.
hap, Yeah.  Hopefully it won't be like high school.
hap," Oh man I am so proud of you, that is...how did you get...I mean what did you do?  How did you find out or what...?"
hap," I have some bad news.  I was like what?  She's like not really you got into U.S.C. and I was like, I was like oh my God.  I was about to tear my own hair out."
hap, Oh man.
hap, Yeah.  This is so crazy.  I mean I didn't get into any other school but I got into the school I wanted.
hap, Did you say yes yet?  I mean have you sent in your answer?
hap, Oh my God the first minute I got it I sent it back in.
hap, All right.
hap, So...
hap," This is so great, you know, because I gone fit on downtown so I'm going to be like right here.  I think I'm going to be living at City Lights downtown."
hap, This is so exciting.  This is like a new chapter in our lives.
hap," Yeah, it really is."
hap," We're doing what we want to do, then four years later we're going to be working professionals, making money, sipping martinis every day."
hap, Man I'm just so happy for you.  I just--
hap, Thank you
hap," Well, I'm happy for you but I'm happy for me cause that means you're going to stay."
hap, And tonight my parents want to take me out to sushi and they said I could bring you.
hap, Oh great. I would love to go.
hap, Yeah and they said get whatever you want and...
hap, Mmmm some miso soup.
hap, Some miso soup.  You can get whatever.  You can get a vat full of miso soup.  God.
hap, This is going to be so great.  I have so many great ideas.
hap," It took them, oh man, it took them like, I mean what it's like April now and any letters that come in April are usually the rejection letters so I was just like..."
neu, Oh my God.  I am so proud of you.
neu, Hello.  This is Viacom Services.  How can I help you?
neu," I'm sorry ma'am, what can I help you with?"
neu, Okay.  Can you give me the last four digits of your social security number so I can verify who I'm speaking with?
neu, two two six six.
neu, Okay.  And your name is?
neu, Olivia. Um. Okay.  So how long has this problem been?
neu, So what exactly is the problem?
neu, Um- I think part of it has to do with the network being down.  It's been having some trouble the last few weeks--
neu, I understand--we're not-
neu, No.  Okay.  We're not charging you for any of these months.  We're going to give you three months free.
neu, We can give you a new phone--
neu, We can do that.  We can do that.  You just have to sign a one-year contract though with the--
ang," You sign the contract and then down the line the phone doesn't work and you're stuck, you can't go to a new...no.  No contracts for me.  You give me a new phone."
ang, I want to talk to a supervisor
ang, I would like to talk to your supervisor.  Obviously you're incompetent and don't understand what I'm asking.
neu," Um- Let me connect you to my supervisor.  Actually, he's out right now so I'm supervisor until he comes back. Um-"
neu," So you could----speak with me some more, you could call back later on maybe."
neu," Mmm hmmm.  Mmm hmmm.  The power outages, everything, hurricane Katrina. Everything's really messed up."
ang, This is ridiculous.Well what are we supposed to do?  We starve then because I can't use my phone cause
ang," I am a realtor and this is my business.  People are calling me all the time but you know, and I don't have a land line.  I can't afford to have a land line"
neu, don't you-
neu, I'm really sorry ma'am.  There's not----a lot we can do for it.
ang, That you better be sorry.
neu," What I can do for you, if you want to make a call right now I could contact you through our computer.  I can call through my phone and you can speak through me."
neu, I'm sorry it has to do with an electrical power outage and stuff--
neu," Well, okay I'm going to give you a free phone card that you can use at any payphone and that's on us. Okay?"
neu," I'm, I'm sorry you chose to live there um--"
neu, Well I'm sure maybe there's a phone at work you could use.
neu, All right um--
neu, My name is Sara.
neu, Sara Brown.
neu," You know maam, we record this conversation so anything you say can be proven in a law of court so keep that in mind."
neu, Hello?
neu, I'm sorry ma'am.  What's the nature of your problem?  But first can I get you to tell me your first and last name?
neu, I know I just need to verify every time.  I'm sorry.
neu, Alright Ms. Brown what's the nature of your problem?
neu, Oh.  I'm sorry. Um- Did you drop it in water?
ang," Yeah, yeah, yeah you better be sorry."
ang, No I did not drop my phone in water.  I'm not five years old and just dropped my phone anywhere I see it.  Okay this is my business.
neu," Um- well it's probably easy.  Can you any more symptoms either you're not receiving calls----ok, you're not receiving calls, not getting calls."
neu, Is the phone turned on?
neu," Well, um- okay.  Your sim card is in- didn't fall out-"
neu, Alright.  Um- Well that could be the problem. cause--
neu, you might have an older phone where we would use sim cards but probably not.
neu, Okay.  How about this we'll send you a brand new camera phone with palm pilot-- and-
neu," So we'll send it- And we'll give you, how about a free year's service?"
neu, Tell them my name.  My name is Brent Backersen.
neu, Okay.  Tell them my - my ID number is two one three five.
neu," Tell them that.  You can go in, get a brand new phone, they'll hook you up with service even give you a free three months--"
neu, It will be free.  No contract okay?
neu," Go in there, yeah, go in there.  Tell them Brent Backersen sent you."
